Time,Title,Description,Link,Datetime
"May 31, 2023 9:37 PM UTC",Eastern Canada struggles to bring wildfires under control,"HALIFAX, Nova Scotia (Reuters) -Wildfires that have already forced thousands in Canada's Nova Scotia province to evacuate were threatening communities on the outskirts of Halifax on Wednesday and causing poor air quality hundreds of miles away as smoke drifted across the U.S. border.",https://www.reuters.com/article/canada-wildfires/eastern-canada-struggles-to-bring-wildfires-under-control-idUSKBN2XM14Q,2023-05-31 09:37:00+00:00
"May 26, 2023 11:03 AM UTC","Earthquake jolts eastern Japan, no tsunami warning, NHK reports","A strong earthquake shook eastern Japan on Friday evening, but there was no tsunami warning, according to public broadcaster NHK.",https://www.reuters.com/article/japan-quake/earthquake-jolts-eastern-japan-no-tsunami-warning-nhk-idUSKBN2XH0OW,2023-05-26 11:03:00+00:00
"May 26, 2023 5:58 AM UTC",US forecasters call for near-normal Atlantic hurricane season,"HOUSTON (Reuters) -This year's Atlantic hurricane season will bring an average number of ocean storms and hurricanes, the National Oceanic and Atmospheric Administration (NOAA) said on Thursday.",https://www.reuters.com/article/usa-weather-hurricanes/us-forecasters-call-for-near-normal-atlantic-hurricane-season-idUSKBN2XG1CR,2023-05-26 05:58:00+00:00
"May 25, 2023 7:16 PM UTC","Most of Guam without power, water after Typhoon Mawar exits",(Reuters) -Much of the U.S. Western Pacific territory of Guam was without power and water on Thursday after a typhoon packing ferocious winds and torrential rains battered the island but caused no reported fatalities or major injuries.,https://www.reuters.com/article/guam-weather/most-of-guam-without-power-water-after-typhoon-mawar-exits-idUSKBN2XG17X,2023-05-25 07:16:00+00:00
"May 25, 2023 7:02 AM UTC",Guam weathers Category 4 super typhoon without major damage,(Reuters) -Guam weathered its most powerful storm in years without major damage on Thursday after Super Typhoon Mawar unleashed winds of up to 150 mph (240 kph) and torrential rain on the Western Pacific Island.,https://www.reuters.com/article/guam-weather/guam-weathers-category-4-super-typhoon-without-major-damage-idUSKBN2XF162,2023-05-25 07:02:00+00:00
"May 25, 2023 6:21 PM UTC","Factbox: What is Volt Typhoon, the alleged China-backed hacking group?","Its name is redolent of an exotic electrical storm. But is the freshly christened hacking group ""Volt Typhoon"" an imminent danger to American infrastructure, or just a new crop of digital spies playing an old game?",https://www.reuters.com/article/usa-china-cyberattack/factbox-what-is-volt-typhoon-the-alleged-china-backed-hacking-group-idUSKBN2XG1LN,2023-05-25 06:21:00+00:00
"May 25, 2023 1:11 AM UTC","Alberta wildfires ease, and Canada natgas exports recover","(Reuters) -Firefighters have made ""significant progress"" in tackling wildfires in Alberta thanks to rain and cooler temperatures, provincial government officials said on Wednesday, as Canadian natural gas exports to the U.S. rebounded after nearly three weeks of lower flows.",https://www.reuters.com/article/canada-wildfires/alberta-wildfires-ease-and-canada-natgas-exports-recover-idUSKBN2XF1GG,2023-05-25 01:11:00+00:00
"May 22, 2023 2:53 AM UTC","Mexican volcano near capital spews more ash, forcing school closures","Mexican authorities canceled in-person classes for more than 100,000 students on Thursday in multiple towns clustered around one of the country's most active volcanoes as its fiery activity intensified in recent days, raising health concerns.",https://www.reuters.com/article/mexico-volcano/mexican-volcano-near-capital-spews-more-ash-forcing-school-closures-idUSKBN2X91VB,2023-05-22 02:53:00+00:00
"May 20, 2023 5:00 PM UTC",Meloni to leave G7 a day early to tackle Italy flood crisis,HIROSHIMA/ROME (Reuters) -Italian Prime Minister Giorgia Meloni said on Saturday she would leave the Group of Seven (G7) summit in Hiroshima a day earlier than scheduled to lead the response to flooding which hit the north of her country this week.,https://www.reuters.com/article/g7-summit-meloni/italys-meloni-to-leave-japan-g7-a-day-early-to-tackle-floods-crisis-at-home-idUSKBN2XB06M,2023-05-20 05:00:00+00:00
"May 19, 2023 10:09 PM UTC",Wildfire risk spurs Alberta park closures ahead of holiday weekend,"OTTAWA (Reuters) -Authorities in Canada's main oil-producing province of Alberta have closed some parks and campgrounds, and are urging residents to avoid activities that could enrage wildfires to avoid straining firefighting resources over the holiday weekend.",https://www.reuters.com/article/canada-weather-wildfire/wildfire-risk-spurs-alberta-park-closures-ahead-of-holiday-weekend-idUSKBN2XA0NZ,2023-05-19 10:09:00+00:00
"May 19, 2023 6:45 AM UTC",Tsunami threat passes in South Pacific after magnitude 7.7 quake off New Caledonia,(Reuters) -The risk of tsunami waves across the South Pacific has passed and national warnings downgraded following a 7.7 magnitude earthquake on Friday southeast of the Loyalty Islands in the French territory of New Caledonia.,https://www.reuters.com/article/new-caledonia-quake/tsunami-threat-passes-in-south-pacific-after-magnitude-7-7-quake-off-new-caledonia-idUSKBN2XA063,2023-05-19 06:45:00+00:00
"May 19, 2023 6:18 PM UTC",Italy's Emilia-Romagna governor says earthquake 'lessons' to help flood recovery,"Italy's Emilia Romagna region will recover from the devastating floods that hit this week by taking from lessons learned from the 2012 earthquake, its governor said Friday, as the death toll from the disaster rose to 14.",https://www.reuters.com/article/europe-weather-italy/italys-emilia-romagna-governor-says-earthquake-lessons-to-help-flood-recovery-idUSKBN2XA1HZ,2023-05-19 06:18:00+00:00
"May 18, 2023 11:10 PM UTC","Alberta wildfires hit gas flow out of Canada to US, spiking prices","OTTAWA (Reuters) -Alberta officials on Thursday warned more wildfires could spread in next few hot and dry days, even as firefighters make progress in tackling widespread blazes that have slowed the outflow of natural gas from Canada into the United States, spiking prices.",https://www.reuters.com/article/canada-weather-wildfire/alberta-wildfires-hit-gas-flow-out-of-canada-to-us-spiking-prices-idUSKBN2X90TM,2023-05-18 11:10:00+00:00
"May 17, 2023 11:10 PM UTC",Canada's Alberta blanketed by smoke as wildfire battle continues,"OTTAWA (Reuters) -Smoke blanketed the skies over much of Alberta on Wednesday as firefighters from Canada and the U.S. battled raging wildfires that have prompted evacuations, disrupted rail service and shut energy production in Canada's main oil-producing province.",https://www.reuters.com/article/canada-weather-wildfires/canadas-alberta-blanketed-by-smoke-as-wildfire-battle-continues-idUSKBN2X8185,2023-05-17 11:10:00+00:00
"May 17, 2023 8:48 PM UTC",UK accelerates London flood defence plan to counter rising climate risk,(This May 16 story has been refiled to correct conversion to '50 miles' in paragraph 2),https://www.reuters.com/article/climate-change-britain/uk-accelerates-london-flood-defence-plan-to-counter-rising-climate-risk-idUSKBN2X71Y1,2023-05-17 08:48:00+00:00
"May 16, 2023 11:21 PM UTC",Two more victims of volcano eruption found in Roman ruins of Pompeii,"Two skeletons have been found in the ruins of Pompeii, the ancient Roman city wiped out by an eruption of volcano Mount Vesuvius nearly 2,000 years ago, the Italian Culture Ministry said on Tuesday.",https://www.reuters.com/article/italy-pompeii/two-more-victims-of-volcano-eruption-found-in-roman-ruins-of-pompeii-idUSKBN2X70SE,2023-05-16 11:21:00+00:00
"May 16, 2023 3:17 PM UTC",Turkey election results show Erdogan dominating in quake-hit region,"Turkish President Tayyip Erdogan's AK Party came out on top in Sunday's elections in 10 of the 11 provinces hit by February's earthquakes, with analysts saying his vow to rebuild devastated cities had reassured voters in what are mostly AKP strongholds.",https://www.reuters.com/article/turkey-election-quake/turkey-election-results-show-erdogan-dominating-in-quake-hit-region-idUSKBN2X716Q,2023-05-16 03:17:00+00:00
"May 15, 2023 10:11 PM UTC",Canadian PM Trudeau visits Alberta as wildfires rage,"OTTAWA (Reuters) -Prime Minister Justin Trudeau visited Alberta on Monday as raging wildfires prompted mass evacuations and reduced energy production in Canada's main oil-producing province, where meteorologists expect virtually no rain for 10 days or so.",https://www.reuters.com/article/canada-weather-wildfires/canadian-pm-trudeau-visits-alberta-as-wildfires-rage-idUSKBN2X6196,2023-05-15 10:11:00+00:00
"May 15, 2023 8:47 AM UTC",Chile's firefighting goats protect a native forest from deadly blazes,"In the southern Chilean city of Santa Juana, hit hard by wildfires earlier this year, locals have a special taskforce helping fight blazes: a herd of goats.",https://www.reuters.com/article/chile-environment-goats/chiles-firefighting-goats-protect-a-native-forest-from-deadly-blazes-idUSKBN2X507D,2023-05-15 08:47:00+00:00
"May 14, 2023 5:38 PM UTC","In Turkish election, some voters return to quake zone to cast ballots","Mehmet Ali Fakioglu was made homeless by an earthquake that hit Turkey in February, but made a 15-hour journey back to the disaster zone to vote on Sunday, recalling the fear he felt when the catastrophe struck and his anger that help was slow to come.",https://www.reuters.com/article/turkey-election-quake-voter/in-turkish-election-some-voters-return-to-quake-zone-to-cast-ballots-idUSKBN2X506S,2023-05-14 05:38:00+00:00
"May 13, 2023 6:21 PM UTC",Syria extends permission on post-quake aid border crossings for 3 months,"(Reuters) -Syria has extended permission for the United Nations to use two additional border crossings for post-earthquake aid for three more months, a Syrian official said on Saturday.",https://www.reuters.com/article/syria-crisis/syria-extends-permission-on-post-quake-aid-border-crossings-for-3-months-idUSKBN2X40CC,2023-05-13 06:21:00+00:00
"May 12, 2023 9:58 PM UTC","Alberta wildfire fighters prepare for hot, dry days ahead","(Reuters) -An extended period of hot, dry weather that risks worsening wildfires in Alberta began on Friday, with special weather alerts in place across western Canada and officials urging people to be vigilant.",https://www.reuters.com/article/canada-weather-wildfires/alberta-wildfire-fighters-prepare-for-hot-dry-days-ahead-idUSKBN2X317G,2023-05-12 09:58:00+00:00
"May 12, 2023 6:02 PM UTC",UN asks Syria to extend deadline for post-quake aid access,"The United Nations has asked Syria's government to extend its approval for two additional crossings to deliver post-earthquake aid into opposition-held zones, a spokesperson said on Friday, but two informed sources said an extension was unlikely.",https://www.reuters.com/article/syria-crisis-crossings/un-asks-syria-to-extend-deadline-for-post-quake-aid-access-idUSKBN2X31EL,2023-05-12 06:02:00+00:00
"May 11, 2023 10:20 PM UTC",Canadian military deployed to help fight Alberta wildfires,OTTAWA (Reuters) -Canada brought in the military to help firefighting and recovery efforts in Alberta on Thursday after wildfires forced thousands to evacuate homes and prompted several oil and gas producers to shut operations in Canada's main crude-producing province.,https://www.reuters.com/article/canada-weather-alberta/canadian-military-deployed-to-help-fight-alberta-wildfires-idUSKBN2X21QW,2023-05-11 10:20:00+00:00
"May 10, 2023 7:45 PM UTC",Thousands still missing as Congo flood survivors search for relatives,"NYAMUKUBI, Democratic Republic of Congo (Reuters) -The death toll from flooding in eastern Democratic Republic of Congo crept higher on Tuesday as aid workers found more bodies among the muddy devastation and wounded residents succumbed to their injuries in an underequipped local clinic.",https://www.reuters.com/article/congo-floods/thousands-still-missing-as-congo-flood-survivors-search-for-relatives-idUSKBN2X00MU,2023-05-10 07:45:00+00:00
"May 9, 2023 10:31 PM UTC",Cooler temperatures offer temporary reprieve for Alberta wildfires,"Wildfires in Canada's main oil-producing province Alberta eased on Tuesday thanks to cooler weather, but thousands of people remained under evacuation orders and officials warned temperatures were expected to rise in coming days.",https://www.reuters.com/article/canada-weather-wildfires/cooler-temperatures-offer-temporary-reprieve-for-alberta-wildfires-idUSKBN2X01V6,2023-05-09 10:31:00+00:00
"May 9, 2023 7:49 PM UTC","Erdogan again? Amid rubble of Turkey's quake, voters demand to be heard ","As the sun beat down on a Turkish tent camp for earthquake survivors, Bahattin Kar emerged from his makeshift shelter to complain about the lack of electricity and water, the unfair distribution of aid and the surging cost of living.",https://www.reuters.com/article/turkey-election-quake/analysis-erdogan-again-amid-rubble-of-turkeys-quake-voters-demand-to-be-heard-idUSKBN2X013C,2023-05-09 07:49:00+00:00
"May 9, 2023 5:59 AM UTC",Wildfires in Canada's main oil province Alberta force producer shutdowns,"(Reuters) -Cooler weather across Alberta on Monday helped firefighters battling widespread wildfires in Canada's main oil-producing province, but the government said it could be months before all the blazes are brought under control.",https://www.reuters.com/article/canada-weather/wildfires-in-canadas-main-oil-province-alberta-force-producer-shutdowns-idUSKBN2WZ0S2,2023-05-09 05:59:00+00:00
"May 8, 2023 5:06 AM UTC",Alberta declares state of emergency over wildfires,"TORONTO (Reuters) -Alberta on Saturday declared a provincial state of emergency after tens of thousands of Albertans have been forced to evacuate their homes as ""unprecedented"" wildfires rage on in Alberta, Premier Danielle Smith, head of the ruling United Conservative Party (UCP) said at a press conference.",https://www.reuters.com/article/canada-weather/alberta-declares-state-of-emergency-over-wildfires-idUSKBN2WX0E8,2023-05-08 05:06:00+00:00
"May 5, 2023 9:33 PM UTC",Fire and floods across western Canada force evacuations,"(Reuters) -A week of record hot weather in western Canada has forced thousands of people to evacuate their homes, as wildfires rage in parts of Alberta and rapid snow melt triggers flooding across interior British Columbia.",https://www.reuters.com/article/canada-weather/fire-and-floods-across-western-canada-force-evacuations-idUSKBN2WW150,2023-05-05 09:33:00+00:00
"May 5, 2023 9:02 AM UTC","Japan earthquake of magnitude 6.5 injures some, damages buildings","TOKYO (Reuters) -An earthquake with a magnitude of 6.5 struck on Friday off Japan's western prefecture of Ishikawa, authorities said, as  media reported some buildings had collapsed while people were injured.",https://www.reuters.com/article/japan-quake/japan-earthquake-of-magnitude-6-5-injures-some-damages-buildings-idUSKBN2WW09F,2023-05-05 09:02:00+00:00
"May 4, 2023 11:38 PM UTC",Sons of Mexican drug lord 'El Chapo' deny trafficking fentanyl in rare letter,"Sons of former Mexican drug lord Joaquin ""El Chapo"" Guzman denied U.S. allegations that they were major traffickers flooding the United States with synthetic opioid fentanyl, addressing the claims against them in a rare letter.",https://www.reuters.com/article/mexico-drugs/sons-of-mexican-drug-lord-el-chapo-deny-trafficking-fentanyl-in-rare-letter-idUSKBN2WV209,2023-05-04 11:38:00+00:00
"May 4, 2023 11:24 AM UTC","Rwanda floods kill 130, destroy over 5,000 houses","Flooding and landslides triggered by heavy rains that have killed 130 people in Rwanda this week have also destroyed more than 5,000 homes, a government spokesperson said on Thursday.",https://www.reuters.com/article/rwanda-floods-int/rwanda-floods-kill-130-destroy-over-5000-houses-idUSKBN2WV0TN,2023-05-04 11:24:00+00:00
"May 4, 2023 5:52 AM UTC","Heavy rain, floods kill at least 136 in Rwanda and Uganda","KIGALI (Reuters) -Flooding and landslides triggered by heavy rain have killed at least 129 people in Rwanda and six in Uganda, authorities said on Wednesday, as rescuers hunted survivors trapped in homes.",https://www.reuters.com/article/rwanda-floods/heavy-rain-floods-kill-at-least-136-in-rwanda-and-uganda-idUSKBN2WU07U,2023-05-04 05:52:00+00:00
